{
  "schema_version": "1.0",
  "page_id": "01j4w4j6v2v4p84n8v7v60m0s7",
  "canonical_url": "https://example.org/docs/",
  "url_key": "https://example.org/docs/",
  "domain": "example.org",
  "collection": "default",
  "visibility": "internal",
  "current_version_id": "01j4w4j7mr6c9s7cezz9n5f2qp",
  "first_visit_id": "01j4w4j0k7hm9j9tx3jz8s2n5q",
  "last_visit_id": "01j4w4j0k7hm9j9tx3jz8s2n5q",
  "version_count": 1,
  "tags": [
    "docs"
  ],
  "created_at": "2026-08-09T12:00:01Z",
  "updated_at": "2026-08-09T12:00:01Z",
  "tombstoned": false
}
